{
  "report_version": 2,
  "runner_version": "source-b0ce96c573e7b374c362b22972c48a1c32797b91",
  "os": "linux",
  "arch": "amd64",
  "summary": {
    "total": 1,
    "passed": 1,
    "failed": 0,
    "cancelled": 0,
    "not_run": 0
  },
  "results": [
    {
      "spec_version": 2,
      "name": "Copy protected multi-line bytes into a nested directory and return to the parent",
      "spec_path": "/mnt/c/Users/abhir/OneDrive/Documents/playtestr/docs/validation/ten-new-project-adversarial-pass/ranger/normal-copy.json",
      "status": "passed",
      "duration_ms": 1285,
      "viewport": {
        "width": 100,
        "height": 30
      },
      "steps": [
        {
          "number": 1,
          "action": "expect",
          "status": "passed",
          "duration_ms": 741
        },
        {
          "number": 2,
          "action": "text",
          "status": "passed",
          "duration_ms": 0
        },
        {
          "number": 3,
          "action": "expect",
          "status": "passed",
          "duration_ms": 10
        },
        {
          "number": 4,
          "action": "text",
          "status": "passed",
          "duration_ms": 0
        },
        {
          "number": 5,
          "action": "expect",
          "status": "passed",
          "duration_ms": 11
        },
        {
          "number": 6,
          "action": "key",
          "status": "passed",
          "duration_ms": 0
        },
        {
          "number": 7,
          "action": "expect_not",
          "status": "passed",
          "duration_ms": 10
        },
        {
          "number": 8,
          "action": "expect",
          "status": "passed",
          "duration_ms": 0
        },
        {
          "number": 9,
          "action": "expect",
          "status": "passed",
          "duration_ms": 0
        },
        {
          "number": 10,
          "action": "expect",
          "status": "passed",
          "duration_ms": 0
        },
        {
          "number": 11,
          "action": "text",
          "status": "passed",
          "duration_ms": 0
        },
        {
          "number": 12,
          "action": "expect_not",
          "status": "passed",
          "duration_ms": 10
        },
        {
          "number": 13,
          "action": "expect",
          "status": "passed",
          "duration_ms": 0
        },
        {
          "number": 14,
          "action": "text",
          "status": "passed",
          "duration_ms": 0
        },
        {
          "number": 15,
          "action": "expect",
          "status": "passed",
          "duration_ms": 10
        },
        {
          "number": 16,
          "action": "key",
          "status": "passed",
          "duration_ms": 0
        },
        {
          "number": 17,
          "action": "expect_not",
          "status": "passed",
          "duration_ms": 11
        },
        {
          "number": 18,
          "action": "expect",
          "status": "passed",
          "duration_ms": 0
        },
        {
          "number": 19,
          "action": "text",
          "status": "passed",
          "duration_ms": 0
        },
        {
          "number": 20,
          "action": "expect",
          "status": "passed",
          "duration_ms": 10
        },
        {
          "number": 21,
          "action": "text",
          "status": "passed",
          "duration_ms": 0
        },
        {
          "number": 22,
          "action": "expect",
          "status": "passed",
          "duration_ms": 10
        },
        {
          "number": 23,
          "action": "key",
          "status": "passed",
          "duration_ms": 0
        },
        {
          "number": 24,
          "action": "expect_not",
          "status": "passed",
          "duration_ms": 11
        },
        {
          "number": 25,
          "action": "expect",
          "status": "passed",
          "duration_ms": 0
        },
        {
          "number": 26,
          "action": "text",
          "status": "passed",
          "duration_ms": 0
        },
        {
          "number": 27,
          "action": "expect",
          "status": "passed",
          "duration_ms": 10
        },
        {
          "number": 28,
          "action": "expect",
          "status": "passed",
          "duration_ms": 0
        },
        {
          "number": 29,
          "action": "expect",
          "status": "passed",
          "duration_ms": 0
        },
        {
          "number": 30,
          "action": "text",
          "status": "passed",
          "duration_ms": 0
        },
        {
          "number": 31,
          "action": "expect_not",
          "status": "passed",
          "duration_ms": 10
        },
        {
          "number": 32,
          "action": "expect",
          "status": "passed",
          "duration_ms": 0
        },
        {
          "number": 33,
          "action": "text",
          "status": "passed",
          "duration_ms": 0
        },
        {
          "number": 34,
          "action": "expect",
          "status": "passed",
          "duration_ms": 10
        },
        {
          "number": 35,
          "action": "key",
          "status": "passed",
          "duration_ms": 0
        },
        {
          "number": 36,
          "action": "expect_not",
          "status": "passed",
          "duration_ms": 10
        },
        {
          "number": 37,
          "action": "expect",
          "status": "passed",
          "duration_ms": 0
        },
        {
          "number": 38,
          "action": "expect",
          "status": "passed",
          "duration_ms": 0
        },
        {
          "number": 39,
          "action": "text",
          "status": "passed",
          "duration_ms": 0
        },
        {
          "number": 40,
          "action": "expect",
          "status": "passed",
          "duration_ms": 10
        },
        {
          "number": 41,
          "action": "text",
          "status": "passed",
          "duration_ms": 0
        },
        {
          "number": 42,
          "action": "expect",
          "status": "passed",
          "duration_ms": 11
        },
        {
          "number": 43,
          "action": "key",
          "status": "passed",
          "duration_ms": 0
        },
        {
          "number": 44,
          "action": "expect_not",
          "status": "passed",
          "duration_ms": 11
        },
        {
          "number": 45,
          "action": "expect",
          "status": "passed",
          "duration_ms": 0
        },
        {
          "number": 46,
          "action": "expect",
          "status": "passed",
          "duration_ms": 0
        },
        {
          "number": 47,
          "action": "text",
          "status": "passed",
          "duration_ms": 0
        },
        {
          "number": 48,
          "action": "expect",
          "status": "passed",
          "duration_ms": 10
        },
        {
          "number": 49,
          "action": "snapshot",
          "status": "passed",
          "duration_ms": 150
        },
        {
          "number": 50,
          "action": "text",
          "status": "passed",
          "duration_ms": 0
        },
        {
          "number": 51,
          "action": "exit",
          "status": "passed",
          "duration_ms": 16
        }
      ],
      "target": {
        "exited": true,
        "exit_code": 0
      },
      "cleanup": {
        "attempted": true,
        "graceful": true,
        "forced": false,
        "confirmed_exited": true,
        "mechanism": "unix-process-group"
      },
      "evidence": {},
      "workspace": {
        "attempted": true,
        "fixture": "fixtures",
        "prepared": true,
        "cleanup_attempted": true,
        "cleaned": true,
        "retained": false
      }
    }
  ]
}
