{
  "report_version": 2,
  "runner_version": "source-ad7f00ac9d375e1e72a8b45c17ee8cb71c3da97b",
  "os": "darwin",
  "arch": "arm64",
  "summary": {
    "total": 1,
    "passed": 0,
    "failed": 1,
    "cancelled": 0,
    "not_run": 0
  },
  "results": [
    {
      "spec_version": 2,
      "name": "Read noninitial long-document pages and return to the beginning",
      "spec_path": "/Users/runner/work/playtestr/playtestr/docs/validation/ten-new-project-adversarial-pass/glow/normal-long-scroll.json",
      "status": "failed",
      "duration_ms": 10174,
      "viewport": {
        "width": 100,
        "height": 30
      },
      "steps": [
        {
          "number": 1,
          "action": "expect",
          "status": "passed",
          "duration_ms": 70
        },
        {
          "number": 2,
          "action": "text",
          "status": "passed",
          "duration_ms": 47
        },
        {
          "number": 3,
          "action": "expect",
          "status": "failed",
          "duration_ms": 10001,
          "failure": {
            "category": "assertion_timeout",
            "message": "Read noninitial long-document pages and return to the beginning: step 3: step timed out: context deadline exceeded"
          }
        },
        {
          "number": 4,
          "action": "text",
          "status": "not_run",
          "duration_ms": 0
        },
        {
          "number": 5,
          "action": "expect",
          "status": "not_run",
          "duration_ms": 0
        },
        {
          "number": 6,
          "action": "snapshot",
          "status": "not_run",
          "duration_ms": 0
        },
        {
          "number": 7,
          "action": "text",
          "status": "not_run",
          "duration_ms": 0
        },
        {
          "number": 8,
          "action": "exit",
          "status": "not_run",
          "duration_ms": 0
        }
      ],
      "target": {
        "exited": true,
        "exit_code": 0
      },
      "failure": {
        "category": "assertion_timeout",
        "message": "Read noninitial long-document pages and return to the beginning: step 3: step timed out: context deadline exceeded"
      },
      "cleanup": {
        "attempted": true,
        "graceful": true,
        "forced": false,
        "confirmed_exited": true,
        "mechanism": "unix-process-group"
      },
      "evidence": {
        "screen_path": "artifacts/ten-new-project-adversarial-pass/glow/bottom-navigation-stays-at-top-1791935033107878000/20261013T234354Z-2029973317/tr-docs-validation-ten-new-project-adversarial-pass-glow-normal-long-scroll.json-57743d18e435.actual.txt"
      },
      "workspace": {
        "attempted": true,
        "fixture": "fixtures",
        "prepared": true,
        "cleanup_attempted": true,
        "cleaned": true,
        "retained": false
      }
    }
  ]
}
