{
  "report_version": 2,
  "runner_version": "source-e8682f866622442c421005c7f477cd45fcc66fc5",
  "os": "linux",
  "arch": "amd64",
  "summary": {
    "total": 1,
    "passed": 0,
    "failed": 1,
    "cancelled": 0,
    "not_run": 0
  },
  "results": [
    {
      "spec_version": 2,
      "name": "Decline replacement of an existing different file",
      "spec_path": "/home/runner/work/playtestr/playtestr/docs/validation/ten-new-project-adversarial-pass/lf/edge-conflicting-rename.json",
      "status": "failed",
      "duration_ms": 1452,
      "viewport": {
        "width": 100,
        "height": 30
      },
      "steps": [
        {
          "number": 1,
          "action": "expect",
          "status": "passed",
          "duration_ms": 1011
        },
        {
          "number": 2,
          "action": "text",
          "status": "passed",
          "duration_ms": 0
        },
        {
          "number": 3,
          "action": "text",
          "status": "passed",
          "duration_ms": 0
        },
        {
          "number": 4,
          "action": "key",
          "status": "passed",
          "duration_ms": 0
        },
        {
          "number": 5,
          "action": "expect",
          "status": "passed",
          "duration_ms": 10
        },
        {
          "number": 6,
          "action": "text",
          "status": "passed",
          "duration_ms": 0
        },
        {
          "number": 7,
          "action": "key",
          "status": "passed",
          "duration_ms": 0
        },
        {
          "number": 8,
          "action": "key",
          "status": "passed",
          "duration_ms": 0
        },
        {
          "number": 9,
          "action": "text",
          "status": "passed",
          "duration_ms": 0
        },
        {
          "number": 10,
          "action": "key",
          "status": "passed",
          "duration_ms": 0
        },
        {
          "number": 11,
          "action": "expect",
          "status": "passed",
          "duration_ms": 10
        },
        {
          "number": 12,
          "action": "text",
          "status": "passed",
          "duration_ms": 0
        },
        {
          "number": 13,
          "action": "expect_not",
          "status": "passed",
          "duration_ms": 11
        },
        {
          "number": 14,
          "action": "snapshot",
          "status": "failed",
          "duration_ms": 251,
          "failure": {
            "category": "snapshot_mismatch",
            "message": "rendered screen did not match the reviewed snapshot"
          }
        },
        {
          "number": 15,
          "action": "text",
          "status": "not_run",
          "duration_ms": 0
        },
        {
          "number": 16,
          "action": "exit",
          "status": "not_run",
          "duration_ms": 0
        }
      ],
      "target": {
        "exited": true
      },
      "failure": {
        "category": "snapshot_mismatch",
        "message": "rendered screen did not match the reviewed snapshot"
      },
      "cleanup": {
        "attempted": true,
        "graceful": false,
        "forced": true,
        "confirmed_exited": true,
        "mechanism": "unix-process-group"
      },
      "evidence": {
        "screen_path": "artifacts/ten-new-project-adversarial-pass/lf/decline-replacement-bypassed-1792098280419247087/20261015T210441Z-1176259960/docs-validation-ten-new-project-adversarial-pass-lf-edge-conflicting-rename.json-28339fff2a3f.actual.txt",
        "diff_path": "artifacts/ten-new-project-adversarial-pass/lf/decline-replacement-bypassed-1792098280419247087/20261015T210441Z-1176259960/docs-validation-ten-new-project-adversarial-pass-lf-edge-conflicting-rename.json-28339fff2a3f.diff.txt"
      },
      "workspace": {
        "attempted": true,
        "fixture": "fixtures",
        "prepared": true,
        "cleanup_attempted": true,
        "cleaned": true,
        "retained": false
      }
    }
  ]
}
