{
  "report_version": 2,
  "runner_version": "source-5f8867aa88aa0f3d6727bc64021b9a906617b58c",
  "os": "windows",
  "arch": "amd64",
  "summary": {
    "total": 1,
    "passed": 0,
    "failed": 1,
    "cancelled": 0,
    "not_run": 0
  },
  "results": [
    {
      "spec_version": 2,
      "name": "Create a real spaced Unicode file and preserve all neighboring bytes",
      "spec_path": "D:\\a\\playtestr\\playtestr\\docs\\validation\\ten-new-project-adversarial-pass\\yazi\\normal-project.json",
      "status": "failed",
      "duration_ms": 10195,
      "viewport": {
        "width": 100,
        "height": 30
      },
      "steps": [
        {
          "number": 1,
          "action": "expect",
          "status": "passed",
          "duration_ms": 80
        },
        {
          "number": 2,
          "action": "text",
          "status": "passed",
          "duration_ms": 0
        },
        {
          "number": 3,
          "action": "expect",
          "status": "passed",
          "duration_ms": 20
        },
        {
          "number": 4,
          "action": "text",
          "status": "passed",
          "duration_ms": 0
        },
        {
          "number": 5,
          "action": "expect",
          "status": "passed",
          "duration_ms": 30
        },
        {
          "number": 6,
          "action": "key",
          "status": "passed",
          "duration_ms": 0
        },
        {
          "number": 7,
          "action": "expect_not",
          "status": "passed",
          "duration_ms": 10
        },
        {
          "number": 8,
          "action": "expect",
          "status": "failed",
          "duration_ms": 10000,
          "failure": {
            "category": "assertion_timeout",
            "message": "Create a real spaced Unicode file and preserve all neighboring bytes: step 8: step timed out: context deadline exceeded"
          }
        },
        {
          "number": 9,
          "action": "expect",
          "status": "not_run",
          "duration_ms": 0
        },
        {
          "number": 10,
          "action": "snapshot",
          "status": "not_run",
          "duration_ms": 0
        },
        {
          "number": 11,
          "action": "text",
          "status": "not_run",
          "duration_ms": 0
        },
        {
          "number": 12,
          "action": "exit",
          "status": "not_run",
          "duration_ms": 0
        }
      ],
      "target": {
        "exited": true,
        "exit_code": 0
      },
      "failure": {
        "category": "assertion_timeout",
        "message": "Create a real spaced Unicode file and preserve all neighboring bytes: step 8: step timed out: context deadline exceeded"
      },
      "cleanup": {
        "attempted": true,
        "graceful": true,
        "forced": false,
        "confirmed_exited": true,
        "mechanism": "windows-job-object"
      },
      "evidence": {
        "screen_path": "artifacts\\ten-new-project-adversarial-pass\\yazi\\creation-diverted-to-unrequested-name-1792121120679792600\\20261016T032749Z-1042138587\\ytestr-docs-validation-ten-new-project-adversarial-pass-yazi-normal-project.json-d439cc1494f6.actual.txt"
      },
      "workspace": {
        "attempted": true,
        "fixture": "fixtures",
        "prepared": true,
        "cleanup_attempted": true,
        "cleaned": true,
        "retained": false
      }
    }
  ]
}
