{
  "report_version": 2,
  "runner_version": "source-e8682f866622442c421005c7f477cd45fcc66fc5",
  "os": "linux",
  "arch": "amd64",
  "summary": {
    "total": 1,
    "passed": 0,
    "failed": 1,
    "cancelled": 0,
    "not_run": 0
  },
  "results": [
    {
      "spec_version": 2,
      "name": "Create a real spaced Unicode file and preserve all neighboring bytes",
      "spec_path": "/home/runner/work/playtestr/playtestr/docs/validation/ten-new-project-adversarial-pass/yazi/normal-project.json",
      "status": "failed",
      "duration_ms": 10221,
      "viewport": {
        "width": 100,
        "height": 30
      },
      "steps": [
        {
          "number": 1,
          "action": "expect",
          "status": "passed",
          "duration_ms": 30
        },
        {
          "number": 2,
          "action": "text",
          "status": "passed",
          "duration_ms": 0
        },
        {
          "number": 3,
          "action": "expect",
          "status": "passed",
          "duration_ms": 11
        },
        {
          "number": 4,
          "action": "text",
          "status": "passed",
          "duration_ms": 0
        },
        {
          "number": 5,
          "action": "expect",
          "status": "passed",
          "duration_ms": 10
        },
        {
          "number": 6,
          "action": "key",
          "status": "passed",
          "duration_ms": 0
        },
        {
          "number": 7,
          "action": "expect_not",
          "status": "passed",
          "duration_ms": 10
        },
        {
          "number": 8,
          "action": "expect",
          "status": "failed",
          "duration_ms": 10000,
          "failure": {
            "category": "assertion_timeout",
            "message": "Create a real spaced Unicode file and preserve all neighboring bytes: step 8: step timed out: context deadline exceeded"
          }
        },
        {
          "number": 9,
          "action": "expect",
          "status": "not_run",
          "duration_ms": 0
        },
        {
          "number": 10,
          "action": "snapshot",
          "status": "not_run",
          "duration_ms": 0
        },
        {
          "number": 11,
          "action": "text",
          "status": "not_run",
          "duration_ms": 0
        },
        {
          "number": 12,
          "action": "exit",
          "status": "not_run",
          "duration_ms": 0
        }
      ],
      "target": {
        "exited": true
      },
      "failure": {
        "category": "assertion_timeout",
        "message": "Create a real spaced Unicode file and preserve all neighboring bytes: step 8: step timed out: context deadline exceeded"
      },
      "cleanup": {
        "attempted": true,
        "graceful": false,
        "forced": true,
        "confirmed_exited": true,
        "mechanism": "unix-process-group"
      },
      "evidence": {
        "screen_path": "artifacts/ten-new-project-adversarial-pass/yazi/creation-diverted-to-unrequested-name-1792104318216001561/20261015T224626Z-4097834009/ytestr-docs-validation-ten-new-project-adversarial-pass-yazi-normal-project.json-39792117e6b3.actual.txt"
      },
      "workspace": {
        "attempted": true,
        "fixture": "fixtures",
        "prepared": true,
        "cleanup_attempted": true,
        "cleaned": true,
        "retained": false
      }
    }
  ]
}
