{
  "report_version": 2,
  "runner_version": "source-5f8867aa88aa0f3d6727bc64021b9a906617b58c",
  "os": "linux",
  "arch": "amd64",
  "summary": {
    "total": 1,
    "passed": 0,
    "failed": 1,
    "cancelled": 0,
    "not_run": 0
  },
  "results": [
    {
      "spec_version": 2,
      "name": "Copy a selected file to a spaced Unicode destination and preserve neighbors",
      "spec_path": "/home/runner/work/playtestr/playtestr/docs/validation/ten-new-project-adversarial-pass/broot/normal-project.json",
      "status": "failed",
      "duration_ms": 208,
      "viewport": {
        "width": 100,
        "height": 30
      },
      "steps": [
        {
          "number": 1,
          "action": "expect",
          "status": "passed",
          "duration_ms": 10
        },
        {
          "number": 2,
          "action": "text",
          "status": "passed",
          "duration_ms": 0
        },
        {
          "number": 3,
          "action": "expect",
          "status": "passed",
          "duration_ms": 10
        },
        {
          "number": 4,
          "action": "text",
          "status": "passed",
          "duration_ms": 0
        },
        {
          "number": 5,
          "action": "text",
          "status": "passed",
          "duration_ms": 0
        },
        {
          "number": 6,
          "action": "expect",
          "status": "passed",
          "duration_ms": 20
        },
        {
          "number": 7,
          "action": "key",
          "status": "passed",
          "duration_ms": 0
        },
        {
          "number": 8,
          "action": "expect",
          "status": "passed",
          "duration_ms": 10
        },
        {
          "number": 9,
          "action": "key",
          "status": "passed",
          "duration_ms": 0
        },
        {
          "number": 10,
          "action": "expect",
          "status": "passed",
          "duration_ms": 10
        },
        {
          "number": 11,
          "action": "snapshot",
          "status": "failed",
          "duration_ms": 140,
          "failure": {
            "category": "snapshot_mismatch",
            "message": "rendered screen did not match the reviewed snapshot"
          }
        },
        {
          "number": 12,
          "action": "text",
          "status": "not_run",
          "duration_ms": 0
        },
        {
          "number": 13,
          "action": "key",
          "status": "not_run",
          "duration_ms": 0
        },
        {
          "number": 14,
          "action": "exit",
          "status": "not_run",
          "duration_ms": 0
        }
      ],
      "target": {
        "exited": true,
        "exit_code": 0
      },
      "failure": {
        "category": "snapshot_mismatch",
        "message": "rendered screen did not match the reviewed snapshot"
      },
      "cleanup": {
        "attempted": true,
        "graceful": true,
        "forced": false,
        "confirmed_exited": true,
        "mechanism": "unix-process-group"
      },
      "evidence": {
        "screen_path": "artifacts/ten-new-project-adversarial-pass/broot/copy-diverted-to-unrequested-name-1792118392627708266/20261016T024028Z-3535083241/testr-docs-validation-ten-new-project-adversarial-pass-broot-normal-project.json-0a1f4eee7858.actual.txt",
        "diff_path": "artifacts/ten-new-project-adversarial-pass/broot/copy-diverted-to-unrequested-name-1792118392627708266/20261016T024028Z-3535083241/testr-docs-validation-ten-new-project-adversarial-pass-broot-normal-project.json-0a1f4eee7858.diff.txt"
      },
      "workspace": {
        "attempted": true,
        "fixture": "fixtures-reviewed",
        "prepared": true,
        "cleanup_attempted": true,
        "cleaned": true,
        "retained": false
      }
    }
  ]
}
