{
  "report_version": 2,
  "runner_version": "source-c1c9f9ef1ae63edd984388342b56905441bc7453",
  "os": "linux",
  "arch": "amd64",
  "summary": {
    "total": 1,
    "passed": 0,
    "failed": 1,
    "cancelled": 0,
    "not_run": 0
  },
  "results": [
    {
      "spec_version": 2,
      "name": "Resize narrow and wide while navigating long Unicode documentation",
      "spec_path": "/home/runner/work/playtestr/playtestr/docs/validation/ten-new-project-adversarial-pass/glow/edge-resize-scroll.json",
      "status": "failed",
      "duration_ms": 10046,
      "viewport": {
        "width": 100,
        "height": 30
      },
      "resizes": [
        {
          "width": 45,
          "height": 18
        }
      ],
      "steps": [
        {
          "number": 1,
          "action": "expect",
          "status": "passed",
          "duration_ms": 40
        },
        {
          "number": 2,
          "action": "resize",
          "status": "passed",
          "duration_ms": 0,
          "resize": {
            "width": 45,
            "height": 18
          }
        },
        {
          "number": 3,
          "action": "text",
          "status": "passed",
          "duration_ms": 0
        },
        {
          "number": 4,
          "action": "expect",
          "status": "failed",
          "duration_ms": 10000,
          "failure": {
            "category": "assertion_timeout",
            "message": "Resize narrow and wide while navigating long Unicode documentation: step 4: step timed out: context deadline exceeded"
          }
        },
        {
          "number": 5,
          "action": "resize",
          "status": "not_run",
          "duration_ms": 0,
          "resize": {
            "width": 120,
            "height": 35
          }
        },
        {
          "number": 6,
          "action": "text",
          "status": "not_run",
          "duration_ms": 0
        },
        {
          "number": 7,
          "action": "expect",
          "status": "not_run",
          "duration_ms": 0
        },
        {
          "number": 8,
          "action": "resize",
          "status": "not_run",
          "duration_ms": 0,
          "resize": {
            "width": 100,
            "height": 30
          }
        },
        {
          "number": 9,
          "action": "text",
          "status": "not_run",
          "duration_ms": 0
        },
        {
          "number": 10,
          "action": "expect",
          "status": "not_run",
          "duration_ms": 0
        },
        {
          "number": 11,
          "action": "snapshot",
          "status": "not_run",
          "duration_ms": 0
        },
        {
          "number": 12,
          "action": "text",
          "status": "not_run",
          "duration_ms": 0
        },
        {
          "number": 13,
          "action": "exit",
          "status": "not_run",
          "duration_ms": 0
        }
      ],
      "target": {
        "exited": true,
        "exit_code": 0
      },
      "failure": {
        "category": "assertion_timeout",
        "message": "Resize narrow and wide while navigating long Unicode documentation: step 4: step timed out: context deadline exceeded"
      },
      "cleanup": {
        "attempted": true,
        "graceful": true,
        "forced": false,
        "confirmed_exited": true,
        "mechanism": "unix-process-group"
      },
      "evidence": {
        "screen_path": "artifacts/ten-new-project-adversarial-pass/glow/edge-resize-scroll-final-0-1791932436333117916/20261013T230036Z-2608241639/tr-docs-validation-ten-new-project-adversarial-pass-glow-edge-resize-scroll.json-b6b3aac2c333.actual.txt"
      },
      "workspace": {
        "attempted": true,
        "fixture": "fixtures",
        "prepared": true,
        "cleanup_attempted": true,
        "cleaned": true,
        "retained": false
      }
    }
  ]
}
