{
  "report_version": 2,
  "runner_version": "dev",
  "os": "linux",
  "arch": "amd64",
  "summary": {
    "total": 1,
    "passed": 1,
    "failed": 0,
    "cancelled": 0,
    "not_run": 0
  },
  "results": [
    {
      "spec_version": 2,
      "name": "Replace and save a complete Unicode document while preserving its neighbor",
      "spec_path": "/mnt/c/Users/abhir/OneDrive/Documents/playtestr/docs/validation/ten-new-project-adversarial-pass/helix/normal-project.json",
      "status": "passed",
      "duration_ms": 579,
      "viewport": {
        "width": 100,
        "height": 30
      },
      "steps": [
        {
          "number": 1,
          "action": "expect",
          "status": "passed",
          "duration_ms": 280
        },
        {
          "number": 2,
          "action": "text",
          "status": "passed",
          "duration_ms": 0
        },
        {
          "number": 3,
          "action": "text",
          "status": "passed",
          "duration_ms": 0
        },
        {
          "number": 4,
          "action": "expect",
          "status": "passed",
          "duration_ms": 10
        },
        {
          "number": 5,
          "action": "text",
          "status": "passed",
          "duration_ms": 0
        },
        {
          "number": 6,
          "action": "key",
          "status": "passed",
          "duration_ms": 0
        },
        {
          "number": 7,
          "action": "text",
          "status": "passed",
          "duration_ms": 0
        },
        {
          "number": 8,
          "action": "key",
          "status": "passed",
          "duration_ms": 0
        },
        {
          "number": 9,
          "action": "expect",
          "status": "passed",
          "duration_ms": 10
        },
        {
          "number": 10,
          "action": "expect",
          "status": "passed",
          "duration_ms": 0
        },
        {
          "number": 11,
          "action": "text",
          "status": "passed",
          "duration_ms": 0
        },
        {
          "number": 12,
          "action": "key",
          "status": "passed",
          "duration_ms": 0
        },
        {
          "number": 13,
          "action": "expect",
          "status": "passed",
          "duration_ms": 11
        },
        {
          "number": 14,
          "action": "snapshot",
          "status": "passed",
          "duration_ms": 149
        },
        {
          "number": 15,
          "action": "text",
          "status": "passed",
          "duration_ms": 0
        },
        {
          "number": 16,
          "action": "key",
          "status": "passed",
          "duration_ms": 0
        },
        {
          "number": 17,
          "action": "exit",
          "status": "passed",
          "duration_ms": 3
        }
      ],
      "target": {
        "exited": true,
        "exit_code": 0
      },
      "cleanup": {
        "attempted": true,
        "graceful": true,
        "forced": false,
        "confirmed_exited": true,
        "mechanism": "unix-process-group"
      },
      "evidence": {},
      "workspace": {
        "attempted": true,
        "fixture": "fixtures",
        "prepared": true,
        "cleanup_attempted": true,
        "cleaned": true,
        "retained": false
      }
    }
  ]
}
