{
  "report_version": 2,
  "runner_version": "source-c1c9f9ef1ae63edd984388342b56905441bc7453",
  "os": "darwin",
  "arch": "arm64",
  "summary": {
    "total": 1,
    "passed": 1,
    "failed": 0,
    "cancelled": 0,
    "not_run": 0
  },
  "results": [
    {
      "spec_version": 2,
      "name": "Discover local documentation and read a specifically filtered overview",
      "spec_path": "/Users/runner/work/playtestr/playtestr/docs/validation/ten-new-project-adversarial-pass/glow/normal-project.json",
      "status": "passed",
      "duration_ms": 574,
      "viewport": {
        "width": 100,
        "height": 30
      },
      "steps": [
        {
          "number": 1,
          "action": "expect",
          "status": "passed",
          "duration_ms": 51
        },
        {
          "number": 2,
          "action": "text",
          "status": "passed",
          "duration_ms": 49
        },
        {
          "number": 3,
          "action": "text",
          "status": "passed",
          "duration_ms": 10
        },
        {
          "number": 4,
          "action": "key",
          "status": "passed",
          "duration_ms": 0
        },
        {
          "number": 5,
          "action": "expect",
          "status": "passed",
          "duration_ms": 22
        },
        {
          "number": 6,
          "action": "snapshot",
          "status": "passed",
          "duration_ms": 141
        },
        {
          "number": 7,
          "action": "text",
          "status": "passed",
          "duration_ms": 41
        },
        {
          "number": 8,
          "action": "exit",
          "status": "passed",
          "duration_ms": 252
        }
      ],
      "target": {
        "exited": true,
        "exit_code": 0
      },
      "cleanup": {
        "attempted": true,
        "graceful": true,
        "forced": false,
        "confirmed_exited": true,
        "mechanism": "unix-process-group"
      },
      "evidence": {},
      "workspace": {
        "attempted": true,
        "fixture": "fixtures",
        "prepared": true,
        "cleanup_attempted": true,
        "cleaned": true,
        "retained": false
      }
    }
  ]
}
