{
  "report_version": 2,
  "runner_version": "source-3b27ffa72d97712e90bc5eec9515a9d5e802b8db",
  "os": "windows",
  "arch": "amd64",
  "summary": {
    "total": 1,
    "passed": 1,
    "failed": 0,
    "cancelled": 0,
    "not_run": 0
  },
  "results": [
    {
      "spec_version": 2,
      "name": "Generate a project with reviewed state",
      "spec_path": "D:\\a\\playtestr\\playtestr\\docs\\validation\\ten-new-project-adversarial-pass\\cookiecutter\\normal-project.json",
      "status": "passed",
      "duration_ms": 666,
      "viewport": {
        "width": 100,
        "height": 30
      },
      "steps": [
        {
          "number": 1,
          "action": "expect",
          "status": "passed",
          "duration_ms": 270
        },
        {
          "number": 2,
          "action": "text",
          "status": "passed",
          "duration_ms": 0
        },
        {
          "number": 3,
          "action": "key",
          "status": "passed",
          "duration_ms": 0
        },
        {
          "number": 4,
          "action": "expect",
          "status": "passed",
          "duration_ms": 20
        },
        {
          "number": 5,
          "action": "text",
          "status": "passed",
          "duration_ms": 0
        },
        {
          "number": 6,
          "action": "key",
          "status": "passed",
          "duration_ms": 0
        },
        {
          "number": 7,
          "action": "expect",
          "status": "passed",
          "duration_ms": 10
        },
        {
          "number": 8,
          "action": "text",
          "status": "passed",
          "duration_ms": 0
        },
        {
          "number": 9,
          "action": "key",
          "status": "passed",
          "duration_ms": 0
        },
        {
          "number": 10,
          "action": "expect",
          "status": "passed",
          "duration_ms": 10
        },
        {
          "number": 11,
          "action": "text",
          "status": "passed",
          "duration_ms": 0
        },
        {
          "number": 12,
          "action": "key",
          "status": "passed",
          "duration_ms": 0
        },
        {
          "number": 13,
          "action": "expect",
          "status": "passed",
          "duration_ms": 30
        },
        {
          "number": 14,
          "action": "text",
          "status": "passed",
          "duration_ms": 0
        },
        {
          "number": 15,
          "action": "key",
          "status": "passed",
          "duration_ms": 0
        },
        {
          "number": 16,
          "action": "exit",
          "status": "passed",
          "duration_ms": 298
        },
        {
          "number": 17,
          "action": "snapshot",
          "status": "passed",
          "duration_ms": 0
        }
      ],
      "target": {
        "exited": true,
        "exit_code": 0
      },
      "cleanup": {
        "attempted": true,
        "graceful": true,
        "forced": false,
        "confirmed_exited": true,
        "mechanism": "windows-job-object"
      },
      "evidence": {},
      "workspace": {
        "attempted": true,
        "fixture": "fixtures",
        "prepared": true,
        "cleanup_attempted": true,
        "cleaned": true,
        "retained": false
      }
    }
  ]
}
